[
  {
    "arm": "D",
    "block": 0,
    "order_index": 0,
    "phase": "primary",
    "position": 0,
    "schema_version": "1.0",
    "target_id": "frameset",
    "timeout_ms": 10000,
    "visit_id": "frameset_0_D"
  },
  {
    "arm": "A",
    "block": 0,
    "order_index": 1,
    "phase": "primary",
    "position": 1,
    "schema_version": "1.0",
    "target_id": "frameset",
    "timeout_ms": 10000,
    "visit_id": "frameset_0_A"
  },
  {
    "arm": "C",
    "block": 0,
    "order_index": 2,
    "phase": "primary",
    "position": 2,
    "schema_version": "1.0",
    "target_id": "frameset",
    "timeout_ms": 10000,
    "visit_id": "frameset_0_C"
  },
  {
    "arm": "B",
    "block": 0,
    "order_index": 3,
    "phase": "primary",
    "position": 3,
    "schema_version": "1.0",
    "target_id": "frameset",
    "timeout_ms": 10000,
    "visit_id": "frameset_0_B"
  },
  {
    "arm": "A",
    "block": 0,
    "order_index": 4,
    "phase": "primary",
    "position": 0,
    "schema_version": "1.0",
    "target_id": "timeout",
    "timeout_ms": 10000,
    "visit_id": "timeout_0_A"
  },
  {
    "arm": "B",
    "block": 0,
    "order_index": 5,
    "phase": "primary",
    "position": 1,
    "schema_version": "1.0",
    "target_id": "timeout",
    "timeout_ms": 10000,
    "visit_id": "timeout_0_B"
  },
  {
    "arm": "D",
    "block": 0,
    "order_index": 6,
    "phase": "primary",
    "position": 2,
    "schema_version": "1.0",
    "target_id": "timeout",
    "timeout_ms": 10000,
    "visit_id": "timeout_0_D"
  },
  {
    "arm": "C",
    "block": 0,
    "order_index": 7,
    "phase": "primary",
    "position": 3,
    "schema_version": "1.0",
    "target_id": "timeout",
    "timeout_ms": 10000,
    "visit_id": "timeout_0_C"
  },
  {
    "arm": "B",
    "block": 0,
    "order_index": 8,
    "phase": "primary",
    "position": 0,
    "schema_version": "1.0",
    "target_id": "error",
    "timeout_ms": 10000,
    "visit_id": "error_0_B"
  },
  {
    "arm": "C",
    "block": 0,
    "order_index": 9,
    "phase": "primary",
    "position": 1,
    "schema_version": "1.0",
    "target_id": "error",
    "timeout_ms": 10000,
    "visit_id": "error_0_C"
  },
  {
    "arm": "A",
    "block": 0,
    "order_index": 10,
    "phase": "primary",
    "position": 2,
    "schema_version": "1.0",
    "target_id": "error",
    "timeout_ms": 10000,
    "visit_id": "error_0_A"
  },
  {
    "arm": "D",
    "block": 0,
    "order_index": 11,
    "phase": "primary",
    "position": 3,
    "schema_version": "1.0",
    "target_id": "error",
    "timeout_ms": 10000,
    "visit_id": "error_0_D"
  },
  {
    "arm": "B",
    "block": 0,
    "order_index": 12,
    "phase": "primary",
    "position": 0,
    "schema_version": "1.0",
    "target_id": "challenge",
    "timeout_ms": 10000,
    "visit_id": "challenge_0_B"
  },
  {
    "arm": "C",
    "block": 0,
    "order_index": 13,
    "phase": "primary",
    "position": 1,
    "schema_version": "1.0",
    "target_id": "challenge",
    "timeout_ms": 10000,
    "visit_id": "challenge_0_C"
  },
  {
    "arm": "A",
    "block": 0,
    "order_index": 14,
    "phase": "primary",
    "position": 2,
    "schema_version": "1.0",
    "target_id": "challenge",
    "timeout_ms": 10000,
    "visit_id": "challenge_0_A"
  },
  {
    "arm": "D",
    "block": 0,
    "order_index": 15,
    "phase": "primary",
    "position": 3,
    "schema_version": "1.0",
    "target_id": "challenge",
    "timeout_ms": 10000,
    "visit_id": "challenge_0_D"
  },
  {
    "arm": "B",
    "block": 0,
    "order_index": 16,
    "phase": "primary",
    "position": 0,
    "schema_version": "1.0",
    "target_id": "large-dom",
    "timeout_ms": 10000,
    "visit_id": "large-dom_0_B"
  },
  {
    "arm": "C",
    "block": 0,
    "order_index": 17,
    "phase": "primary",
    "position": 1,
    "schema_version": "1.0",
    "target_id": "large-dom",
    "timeout_ms": 10000,
    "visit_id": "large-dom_0_C"
  },
  {
    "arm": "A",
    "block": 0,
    "order_index": 18,
    "phase": "primary",
    "position": 2,
    "schema_version": "1.0",
    "target_id": "large-dom",
    "timeout_ms": 10000,
    "visit_id": "large-dom_0_A"
  },
  {
    "arm": "D",
    "block": 0,
    "order_index": 19,
    "phase": "primary",
    "position": 3,
    "schema_version": "1.0",
    "target_id": "large-dom",
    "timeout_ms": 10000,
    "visit_id": "large-dom_0_D"
  },
  {
    "arm": "B",
    "block": 0,
    "order_index": 20,
    "phase": "primary",
    "position": 0,
    "schema_version": "1.0",
    "target_id": "download",
    "timeout_ms": 10000,
    "visit_id": "download_0_B"
  },
  {
    "arm": "C",
    "block": 0,
    "order_index": 21,
    "phase": "primary",
    "position": 1,
    "schema_version": "1.0",
    "target_id": "download",
    "timeout_ms": 10000,
    "visit_id": "download_0_C"
  },
  {
    "arm": "A",
    "block": 0,
    "order_index": 22,
    "phase": "primary",
    "position": 2,
    "schema_version": "1.0",
    "target_id": "download",
    "timeout_ms": 10000,
    "visit_id": "download_0_A"
  },
  {
    "arm": "D",
    "block": 0,
    "order_index": 23,
    "phase": "primary",
    "position": 3,
    "schema_version": "1.0",
    "target_id": "download",
    "timeout_ms": 10000,
    "visit_id": "download_0_D"
  },
  {
    "arm": "D",
    "block": 0,
    "order_index": 24,
    "phase": "primary",
    "position": 0,
    "schema_version": "1.0",
    "target_id": "upload",
    "timeout_ms": 10000,
    "visit_id": "upload_0_D"
  },
  {
    "arm": "A",
    "block": 0,
    "order_index": 25,
    "phase": "primary",
    "position": 1,
    "schema_version": "1.0",
    "target_id": "upload",
    "timeout_ms": 10000,
    "visit_id": "upload_0_A"
  },
  {
    "arm": "C",
    "block": 0,
    "order_index": 26,
    "phase": "primary",
    "position": 2,
    "schema_version": "1.0",
    "target_id": "upload",
    "timeout_ms": 10000,
    "visit_id": "upload_0_C"
  },
  {
    "arm": "B",
    "block": 0,
    "order_index": 27,
    "phase": "primary",
    "position": 3,
    "schema_version": "1.0",
    "target_id": "upload",
    "timeout_ms": 10000,
    "visit_id": "upload_0_B"
  },
  {
    "arm": "D",
    "block": 0,
    "order_index": 28,
    "phase": "primary",
    "position": 0,
    "schema_version": "1.0",
    "target_id": "usable",
    "timeout_ms": 10000,
    "visit_id": "usable_0_D"
  },
  {
    "arm": "A",
    "block": 0,
    "order_index": 29,
    "phase": "primary",
    "position": 1,
    "schema_version": "1.0",
    "target_id": "usable",
    "timeout_ms": 10000,
    "visit_id": "usable_0_A"
  },
  {
    "arm": "C",
    "block": 0,
    "order_index": 30,
    "phase": "primary",
    "position": 2,
    "schema_version": "1.0",
    "target_id": "usable",
    "timeout_ms": 10000,
    "visit_id": "usable_0_C"
  },
  {
    "arm": "B",
    "block": 0,
    "order_index": 31,
    "phase": "primary",
    "position": 3,
    "schema_version": "1.0",
    "target_id": "usable",
    "timeout_ms": 10000,
    "visit_id": "usable_0_B"
  },
  {
    "arm": "A",
    "block": 0,
    "order_index": 32,
    "phase": "primary",
    "position": 0,
    "schema_version": "1.0",
    "target_id": "captcha",
    "timeout_ms": 10000,
    "visit_id": "captcha_0_A"
  },
  {
    "arm": "B",
    "block": 0,
    "order_index": 33,
    "phase": "primary",
    "position": 1,
    "schema_version": "1.0",
    "target_id": "captcha",
    "timeout_ms": 10000,
    "visit_id": "captcha_0_B"
  },
  {
    "arm": "D",
    "block": 0,
    "order_index": 34,
    "phase": "primary",
    "position": 2,
    "schema_version": "1.0",
    "target_id": "captcha",
    "timeout_ms": 10000,
    "visit_id": "captcha_0_D"
  },
  {
    "arm": "C",
    "block": 0,
    "order_index": 35,
    "phase": "primary",
    "position": 3,
    "schema_version": "1.0",
    "target_id": "captcha",
    "timeout_ms": 10000,
    "visit_id": "captcha_0_C"
  },
  {
    "arm": "B",
    "block": 0,
    "order_index": 36,
    "phase": "primary",
    "position": 0,
    "schema_version": "1.0",
    "target_id": "block",
    "timeout_ms": 10000,
    "visit_id": "block_0_B"
  },
  {
    "arm": "C",
    "block": 0,
    "order_index": 37,
    "phase": "primary",
    "position": 1,
    "schema_version": "1.0",
    "target_id": "block",
    "timeout_ms": 10000,
    "visit_id": "block_0_C"
  },
  {
    "arm": "A",
    "block": 0,
    "order_index": 38,
    "phase": "primary",
    "position": 2,
    "schema_version": "1.0",
    "target_id": "block",
    "timeout_ms": 10000,
    "visit_id": "block_0_A"
  },
  {
    "arm": "D",
    "block": 0,
    "order_index": 39,
    "phase": "primary",
    "position": 3,
    "schema_version": "1.0",
    "target_id": "block",
    "timeout_ms": 10000,
    "visit_id": "block_0_D"
  },
  {
    "arm": "A",
    "block": 0,
    "order_index": 40,
    "phase": "primary",
    "position": 0,
    "schema_version": "1.0",
    "target_id": "popup",
    "timeout_ms": 10000,
    "visit_id": "popup_0_A"
  },
  {
    "arm": "B",
    "block": 0,
    "order_index": 41,
    "phase": "primary",
    "position": 1,
    "schema_version": "1.0",
    "target_id": "popup",
    "timeout_ms": 10000,
    "visit_id": "popup_0_B"
  },
  {
    "arm": "D",
    "block": 0,
    "order_index": 42,
    "phase": "primary",
    "position": 2,
    "schema_version": "1.0",
    "target_id": "popup",
    "timeout_ms": 10000,
    "visit_id": "popup_0_D"
  },
  {
    "arm": "C",
    "block": 0,
    "order_index": 43,
    "phase": "primary",
    "position": 3,
    "schema_version": "1.0",
    "target_id": "popup",
    "timeout_ms": 10000,
    "visit_id": "popup_0_C"
  },
  {
    "arm": "A",
    "block": 0,
    "order_index": 44,
    "phase": "primary",
    "position": 0,
    "schema_version": "1.0",
    "target_id": "iframe",
    "timeout_ms": 10000,
    "visit_id": "iframe_0_A"
  },
  {
    "arm": "B",
    "block": 0,
    "order_index": 45,
    "phase": "primary",
    "position": 1,
    "schema_version": "1.0",
    "target_id": "iframe",